{
  "personal_info": {
    "name": "Morgan Vance",
    "headline": "Staff Cloud Infrastructure Engineer & Distributed Systems Architect",
    "location": "Austin, TX",
    "email": "morgan.vance@example.com",
    "phone": "(555) 328-9104",
    "linkedin": "https://www.linkedin.com/in/morgan-vance-cloud",
    "github": "https://github.com/morgan-vance-demo",
    "portfolio": "https://morganvance.dev",
    "badge_credential": "AWS Certified Solutions Architect Professional | CKA Certified"
  },
  "professional_summary": {
    "default_pitch": "Senior Cloud Infrastructure Engineer with 9+ years of experience architecting highly available, multi-region cloud platforms and Kubernetes orchestration systems. Proven track record reducing cloud infrastructure spend by 38% ($450K/year), engineering zero-downtime microservices migrations, and establishing GitOps continuous delivery pipelines maintaining 99.99% service availability across high-volume enterprise production environments.",
    "specialties": [
      "Multi-Region Cloud Architecture (AWS & GCP)",
      "Kubernetes Orchestration & Service Mesh (EKS, Helm, Istio)",
      "Infrastructure as Code & Policy as Code (Terraform, OpenTofu, Terragrunt)",
      "Continuous Integration & GitOps Delivery (GitHub Actions, ArgoCD)",
      "Observability & Site Reliability Engineering (Datadog, Prometheus, Grafana)",
      "Cloud FinOps & Infrastructure Cost Optimization"
    ]
  },
  "skills": {
    "cloud_and_infrastructure": [
      "Amazon Web Services (AWS)",
      "Google Cloud Platform (GCP)",
      "Kubernetes (EKS / GKE)",
      "Terraform & OpenTofu",
      "Docker & Containerd",
      "Linux Systems Architecture",
      "VPC & Hybrid Networking",
      "Serverless Architecture (AWS Lambda)"
    ],
    "devops_and_automation": [
      "GitHub Actions CI/CD",
      "ArgoCD & GitOps",
      "Helm Package Management",
      "Ansible Configuration Management",
      "Python & Bash Automation",
      "Packer Golden Images",
      "Zero-Downtime Deployment Strategies"
    ],
    "observability_and_reliability": [
      "Datadog Enterprise APM",
      "Prometheus & Grafana",
      "OpenTelemetry Standards",
      "Distributed Tracing & SRE Metrics",
      "ELK & OpenSearch Stacks",
      "Incident Response & Postmortems",
      "Chaos Engineering Practices"
    ],
    "security_and_governance": [
      "IAM & Principle of Least Privilege",
      "HashiCorp Vault Secrets Management",
      "SOC 2 Type II Audit Preparation",
      "Container Image Security (Trivy, Snyk)",
      "TLS / mTLS Encryption Architecture",
      "CloudTrail & Security Incident Monitoring"
    ]
  },
  "experience": [
    {
      "id": "role-stratos-2022",
      "company": "Stratos Cloud Systems",
      "title": "Staff Platform Infrastructure Engineer",
      "role_title": "Staff Platform Infrastructure Engineer",
      "location": "Austin, TX (Remote)",
      "start_date": "2022-03",
      "end_date": "Present",
      "is_current": true,
      "company_description": "Series D enterprise cloud data platform processing over 600M real-time streaming transactions daily.",
      "skills": [
        "AWS",
        "Terraform",
        "Kubernetes",
        "ArgoCD",
        "Karpenter",
        "Python",
        "Datadog",
        "FinOps"
      ],
      "bullets": [
        {
          "id": "stratos-b1",
          "framework": "XYZ",
          "text": "Architected and orchestrated zero-downtime migration of 140+ microservices to Amazon EKS clusters, reducing annual cloud compute costs by 38% ($450K) while scaling platform transaction throughput by 300%.",
          "action_x": "Architected and orchestrated zero-downtime migration of 140+ microservices to Amazon EKS clusters",
          "metric_y": "reducing annual cloud compute costs by 38% ($450K) while scaling platform transaction throughput by 300%",
          "context_z": "by implementing declarative Helm charts, Karpenter dynamic node provisioning, and spot instance fleet automation",
          "tags": [
            "#cloud",
            "#kubernetes",
            "#aws",
            "#finops",
            "#architecture"
          ],
          "relevance_keywords": [
            "Kubernetes",
            "EKS",
            "AWS",
            "Cost Optimization",
            "Microservices",
            "FinOps",
            "Helm"
          ],
          "variations": [
            {
              "style": "metric-focused",
              "text": "Saved $450,000 annually (38% compute reduction) and expanded transaction throughput 3x by migrating 140+ microservices to Amazon EKS with Karpenter autoscaling."
            },
            {
              "style": "leadership-focused",
              "text": "Led cross-functional platform migration to Amazon EKS across 9 product engineering squads, eliminating legacy container deployment friction and optimizing cloud spend."
            },
            {
              "style": "technical-focused",
              "text": "Designed high-density Kubernetes cluster infrastructure on AWS using Terraform and Karpenter, establishing multi-tenant namespaces with automated resource quotas and Spot instance fallback."
            }
          ]
        },
        {
          "id": "stratos-b2",
          "framework": "XYZ",
          "text": "Engineered enterprise-wide GitOps delivery framework with ArgoCD and GitHub Actions, shortening deployment cycle times from 45 minutes to 4.2 minutes and cutting failed production rollouts by 82%.",
          "action_x": "Engineered enterprise-wide GitOps delivery framework with ArgoCD and GitHub Actions",
          "metric_y": "shortening deployment cycle times from 45 minutes to 4.2 minutes and cutting failed production rollouts by 82%",
          "context_z": "by establishing progressive canary releases, automated smoke validation gates, and instant automated rollback triggers",
          "tags": [
            "#gitops",
            "#devops",
            "#argocd",
            "#cicd",
            "#automation"
          ],
          "relevance_keywords": [
            "GitOps",
            "ArgoCD",
            "CI/CD",
            "GitHub Actions",
            "Canary Deployment",
            "Rollback Automation"
          ],
          "variations": [
            {
              "style": "metric-focused",
              "text": "Accelerated release frequency by 10x (45m to 4.2m) and dropped production incidents by 82% utilizing ArgoCD declarative GitOps pipelines and automated canary gates."
            },
            {
              "style": "operations-focused",
              "text": "Standardized continuous deployment workflows for 120+ software engineers, instituting immutable image signing, automated smoke testing, and zero-touch cluster reconciliations."
            }
          ]
        },
        {
          "id": "stratos-b3",
          "framework": "XYZ",
          "text": "Constructed distributed observability platform utilizing OpenTelemetry, Prometheus, and Datadog, decreasing Mean Time to Detect (MTTD) from 24 minutes to under 2 minutes across 5 production regions.",
          "action_x": "Constructed distributed observability platform utilizing OpenTelemetry, Prometheus, and Datadog",
          "metric_y": "decreasing Mean Time to Detect (MTTD) from 24 minutes to under 2 minutes across 5 production regions",
          "context_z": "by unifying distributed traces, custom metric aggregations, and context-rich synthetic alerting webhooks",
          "tags": [
            "#observability",
            "#monitoring",
            "#datadog",
            "#sre",
            "#opentelemetry"
          ],
          "relevance_keywords": [
            "Observability",
            "Datadog",
            "Prometheus",
            "OpenTelemetry",
            "MTTD",
            "Distributed Tracing",
            "SRE"
          ],
          "variations": [
            {
              "style": "reliability-focused",
              "text": "Reduced production outage discovery time by 91% (MTTD from 24m to <2m) by deploying unified OpenTelemetry instrumentation and automated SLI/SLO dashboards."
            },
            {
              "style": "architectural-focused",
              "text": "Integrated full-stack APM tracing and synthetic canary monitors across 5 AWS regions, delivering real-time latency diagnostics to engineering and customer success teams."
            }
          ]
        }
      ]
    },
    {
      "id": "role-helios-2019",
      "company": "Helios Financial Technologies",
      "title": "Senior Infrastructure & Cloud Security Engineer",
      "role_title": "Senior Infrastructure & Cloud Security Engineer",
      "location": "Denver, CO",
      "start_date": "2019-06",
      "end_date": "2022-02",
      "is_current": false,
      "company_description": "Fintech payment processing gateway facilitating secure ACH and card transaction networks for regional financial institutions.",
      "skills": [
        "Terraform",
        "AWS",
        "HashiCorp Vault",
        "Docker",
        "PostgreSQL",
        "Python",
        "SOC 2"
      ],
      "bullets": [
        {
          "id": "helios-b1",
          "framework": "XYZ",
          "text": "Refactored manual cloud infrastructure into 100% codified Terraform modules with automated policy validation, accelerating new environment provisioning from 14 days to 35 minutes.",
          "action_x": "Refactored manual cloud infrastructure into 100% codified Terraform modules with automated policy validation",
          "metric_y": "accelerating new environment provisioning from 14 days to 35 minutes",
          "context_z": "by designing modular reusable VPC, database, and caching architectures with tfsec and Open Policy Agent guardrails",
          "tags": [
            "#terraform",
            "#iac",
            "#automation",
            "#cloud",
            "#security"
          ],